{
  "schemaVersion": "v0.11.8.0",
  "qualificationVersion": "v0.11.8.1",
  "environment": "aws-dev",
  "status": "failed",
  "observationWindow": {
    "startedAt": "2026-09-01T12:54:04Z",
    "finishedAt": "2026-09-01T12:54:32Z"
  },
  "identity": {
    "awsAccountId": "542478884409",
    "awsRegion": "us-east-1",
    "clusterName": "startup-devops-baseline-dev",
    "kubeContext": "arn:aws:eks:us-east-1:542478884409:cluster/startup-devops-baseline-dev",
    "repositoryCommit": "a9dccdabff5285dace7ed252774444b924a47f1d",
    "targetRevision": "a9dccdabff5285dace7ed252774444b924a47f1d",
    "applicationVersion": "sha-48244a2"
  },
  "approval": {
    "required": false,
    "approved": false,
    "reference": null
  },
  "capabilities": {
    "metrics": {
      "status": "supported-not-verified",
      "evidenceCheckIds": []
    },
    "dashboards": {
      "status": "supported-not-verified",
      "evidenceCheckIds": []
    },
    "alerts": {
      "status": "supported-not-verified",
      "evidenceCheckIds": []
    },
    "logs": {
      "status": "not-deployed",
      "evidenceCheckIds": []
    },
    "traces": {
      "status": "not-deployed",
      "evidenceCheckIds": []
    },
    "slo": {
      "status": "supported-not-verified",
      "evidenceCheckIds": []
    },
    "progressiveDeliveryTelemetry": {
      "status": "not-applicable",
      "evidenceCheckIds": []
    }
  },
  "checks": [
    {
      "id": "runtime.discovery",
      "outcome": "not-run",
      "observedValue": null,
      "diagnostic": "rbac_boundary_failed"
    }
  ]
}
